{
  "schema": 1,
  "symbol_id": "xiaomi-band-9-pro-3.1.175.bluetooth.bt_pair_display_reply",
  "target_id": "xiaomi-band-9-pro-3.1.175",
  "name": "bt_pair_display_reply",
  "kind": "function",
  "instruction_set": "thumb",
  "entry_address": "0xc4dba68",
  "callable_address": "0xc4dba69",
  "prototype": "int32(void *, const uint8_t *, int32_t, int32_t)",
  "calling_convention": "arm-aapcs",
  "contexts": {
    "allowed": [
      "native_module_bluetooth_client"
    ],
    "blocking": false
  },
  "proof": {
    "static": "candidate",
    "evidence_ids": [
      "EVID-FW-MATCH-ENSEMBLE-1036-9175"
    ],
    "device": "not_probed"
  },
  "policy": "restricted",
  "status": "CANDIDATE",
  "provenance": {
    "firmware_sha256": "4f43b325addd6d9e6e7c7e2a4d00ffe3f23d5fb1560d8fe503544002ac1f516b",
    "evidence_ids": [
      "EVID-FW-MATCH-ENSEMBLE-1036-9175"
    ],
    "source": "bindiff-inspired-ensemble-v2 source=xiaomi-band-10-pro-3.101.036 report=targets/xiaomi-band-9-pro-3.1.175/evidence/fw-match/ensemble-1036-to-9175-v2.json"
  },
  "approval_state": "PENDING",
  "notes": "Generated candidate only; requires independent ABI/callsite review before promotion. state=CANDIDATE confidence=0.5476 margin=0.0000"
}
