{
  "schema": 1,
  "symbol_id": "xiaomi-band-11-4.100.108.private_abi.bt_l2cap_disconnect",
  "target_id": "xiaomi-band-11-4.100.108",
  "name": "bt_l2cap_disconnect",
  "kind": "function",
  "instruction_set": "thumb",
  "entry_address": "0xc493850",
  "prototype": "int(const void *)",
  "calling_convention": "arm-aapcs",
  "contexts": {
    "allowed": [
      "target-private"
    ],
    "blocking": false
  },
  "proof": {
    "static": "candidate",
    "device": "not_probed",
    "evidence_ids": [
      "EVID-FW-MATCH-ENSEMBLE-1036-1108"
    ]
  },
  "policy": "restricted",
  "status": "CANDIDATE",
  "provenance": {
    "firmware_sha256": "9315ca353f624cec25dfcfc98a95ba959e2d7b24573bf1d6adf16ea10341bd99",
    "evidence_ids": [
      "EVID-FW-MATCH-ENSEMBLE-1036-1108"
    ],
    "source": "bindiff-inspired-ensemble-v2 source=xiaomi-band-10-pro-3.101.036 report=targets/xiaomi-band-11-4.100.108/evidence/fw-match/ensemble-1036-to-1108-v2.json"
  },
  "approval_state": "PENDING",
  "notes": "Generated candidate only; requires independent ABI/callsite review before promotion. state=CANDIDATE confidence=0.6225 margin=0.0189",
  "callable_address": "0xc493851"
}
