{
  "schema": 1,
  "symbol_id": "xiaomi-band-11-4.100.179.screen.screen_session_restore_default",
  "target_id": "xiaomi-band-11-4.100.179",
  "name": "screen_session_restore_default",
  "kind": "function",
  "instruction_set": "thumb",
  "entry_address": "0xc6cd78c",
  "callable_address": "0xc6cd78d",
  "prototype": "void(void *session)",
  "calling_convention": "arm-aapcs",
  "contexts": {
    "allowed": [
      "ui-owner-thread"
    ],
    "blocking": true
  },
  "proof": {
    "static": "recovered",
    "device": "not_probed",
    "evidence_ids": [
      "EVID-PORT-4179-001"
    ]
  },
  "policy": "restricted",
  "status": "STATIC_RECOVERED",
  "approval_state": "PENDING",
  "provenance": {
    "firmware_sha256": "307adabe0ff61c77be73d045a8260e279cddd131c7a535a2678eb34199278a2b",
    "evidence_ids": [
      "EVID-PORT-4179-001"
    ],
    "source": "Exact xiaomi-band-11-4.100.179 image/IDB compared with xiaomi-band-11-4.100.155: mutually unique full-body anchor; known callees consistent."
  },
  "notes": "mutually unique full-body anchor; known callees consistent. Source semantic status was STATIC_RECOVERED; matching does not upgrade an uncertain source name/prototype. ABI and ownership follow the source record only within the audited port scope. Physical device validation pending; no approval carries over from the source target. Clears the session's overrides. Supervisor platform hardware service; static evidence only, device NOT_PROBED."
}
