{
  "schema": 1,
  "symbol_id": "redmi-watch-6-3.100.043.launcher_reset_order_info",
  "target_id": "redmi-watch-6-3.100.043",
  "name": "launcher_reset_order_info",
  "kind": "function",
  "instruction_set": "thumb",
  "calling_convention": "arm-aapcs",
  "prototype": "int(void)",
  "entry_address": "0xc7ecafc",
  "callable_address": "0xc7ecafd",
  "proof": {
    "static": "recovered",
    "device": "not_probed",
    "evidence_ids": [
      "EVID-STATIC-P65-002"
    ]
  },
  "policy": "restricted",
  "status": "STATIC_RECOVERED",
  "provenance": {
    "firmware_sha256": "a19b601477569765103eaf468b937bd8026b4d68ffa5c896bde222a79e475858",
    "evidence_ids": [
      "EVID-STATIC-P65-002"
    ],
    "source": "manual review of the exact 3.100.043 IDB (EVID-STATIC-P65-002)"
  },
  "notes": "manual static-test accept 2026-10-25 (EVID-STATIC-P65-002): launcher_reset_order_info: iterates the launcher app list (0xc8bf0b8/0xc8beaa8) and rebuilds the order metadata; the firmware names it \"launcher_reset_order_list\", so the routine is proven while the requested name is an alias. Restricted/PENDING; device NOT_PROBED.",
  "approval_state": "PENDING"
}
