{
  "schema": 1,
  "symbol_id": "xiaomi-band-11-4.100.139.system.system_state",
  "target_id": "xiaomi-band-11-4.100.139",
  "name": "system_state",
  "kind": "global",
  "instruction_set": "n/a",
  "entry_address": "0x200c1d0c",
  "prototype": "uint8_t *",
  "contexts": {
    "allowed": [
      "ui-owner-thread"
    ],
    "blocking": false
  },
  "proof": {
    "static": "recovered",
    "device": "not_probed",
    "evidence_ids": [
      "EVID-PLATFORM-HW-4139-001"
    ]
  },
  "policy": "restricted",
  "status": "STATIC_RECOVERED",
  "approval_state": "PENDING",
  "provenance": {
    "firmware_sha256": "31ce82257f7c127950dc5070b86316730cf468a41f0d004559e41e7d923b2c74",
    "evidence_ids": [
      "EVID-PLATFORM-HW-4139-001"
    ],
    "source": "exact 4.100.139 IDB vela_ap.bin.i64; body shape identical to the reviewed 4.100.155 function and unique in this image"
  },
  "notes": "Pointer to the system_all_state struct, NULL until system_init_state runs. Byte +1 is the MiWear connection state and byte +2 the Bluetooth ACL state (update_from_bt_state), 1 down / 2 up. Read-only. Static evidence only, device NOT_PROBED."
}
