{
  "schema": 1,
  "symbol_id": "xiaomi-band-10-pro-3.101.036.ui.lv_image_set_src",
  "target_id": "xiaomi-band-10-pro-3.101.036",
  "name": "lv_image_set_src",
  "kind": "function",
  "instruction_set": "thumb",
  "entry_address": "0x0C179FD0",
  "callable_address": "0x0C179FD1",
  "prototype": "void(void *, const void *)",
  "calling_convention": "arm-aapcs",
  "contexts": {
    "allowed": [
      "native_manager_owner",
      "target-private-ui-owner"
    ],
    "blocking": false
  },
  "ownership": {
    "argument": "borrowed page parent/widget and source",
    "return_value": "n/a"
  },
  "side_effects": [
    "retains_image_source"
  ],
  "proof": {
    "static": "confirmed",
    "device": "not_probed",
    "host_tested": false,
    "evidence_ids": [
      "EVID-UI-MEDIA-001"
    ]
  },
  "policy": "restricted",
  "status": "STATIC_CONFIRMED",
  "provenance": {
    "firmware_sha256": "662d67f5e247e31e194d3161024890ba93b9d29d70b290fadb9aac8ce8ec3c81",
    "evidence_ids": [
      "EVID-UI-MEDIA-001"
    ],
    "source": "IDA exact-target analysis: fw://xiaomi-band-10-pro-3.101.036/vela_ap.bin.i64"
  },
  "notes": "Exact-target UI-owner primitive. Exposed through target-private semantic adapters; device proof remains pending.",
  "approval_state": "PENDING"
}
