{
  "schema": 1,
  "symbol_id": "xiaomi-band-11-4.100.179.private_abi.qjs_free_value",
  "target_id": "xiaomi-band-11-4.100.179",
  "name": "qjs_free_value",
  "kind": "function",
  "instruction_set": "thumb",
  "entry_address": "0xc3b80a4",
  "callable_address": "0xc3b80a5",
  "prototype": "void(void *, uint64_t)",
  "calling_convention": "arm-aapcs",
  "contexts": {
    "allowed": [
      "target-private",
      "qjs-owner-task"
    ],
    "blocking": false
  },
  "ownership": {
    "argument": "Decrements owned JSValue reference on context owner task."
  },
  "proof": {
    "static": "recovered",
    "device": "not_probed",
    "evidence_ids": [
      "EVID-PORT-4179-ASTROLINK-001"
    ]
  },
  "policy": "restricted",
  "status": "STATIC_RECOVERED",
  "provenance": {
    "firmware_sha256": "307adabe0ff61c77be73d045a8260e279cddd131c7a535a2678eb34199278a2b",
    "evidence_ids": [
      "EVID-PORT-4179-ASTROLINK-001"
    ],
    "source": "Exact .179 IDB (vela_ap.bin, sha256 307adabe0ff61c77be73d045a8260e279cddd131c7a535a2678eb34199278a2b) compared with the reviewed .155 record: equal Thumb mnemonic sequence over the whole body with an identical structure-immediate set, anchored caller/callee correspondence and decompiler comparison of the surrounding consumers."
  },
  "approval_state": "PENDING",
  "notes": "equal Thumb mnemonic sequence over the whole body with an identical structure-immediate set, anchored caller/callee correspondence and decompiler comparison of the surrounding consumers. Source semantic status STATIC_RECOVERED; the port does not upgrade an uncertain name, prototype or ownership. ABI and ownership follow the .155 baseline within the audited port scope. Physical device validation pending."
}
