{
  "schema": 1,
  "symbol_id": "xiaomi-band-9-3.1.32.nuttx.lseek",
  "target_id": "xiaomi-band-9-3.1.32",
  "name": "lseek",
  "kind": "function",
  "instruction_set": "thumb",
  "entry_address": "0xc3ba3f8",
  "callable_address": "0xc3ba3f9",
  "prototype": "int64_t(int, int64_t, int)",
  "calling_convention": "arm-aapcs",
  "contexts": {
    "allowed": [
      "connection_framework_owner"
    ],
    "blocking": true
  },
  "proof": {
    "static": "candidate",
    "evidence_ids": [
      "EVID-FW-MATCH-ENSEMBLE-1036-9132"
    ],
    "device": "not_probed"
  },
  "policy": "restricted",
  "status": "CANDIDATE",
  "provenance": {
    "firmware_sha256": "9c02dab4020b2cc9666ee7d34cf27d311b76aadcec519a38361bbcbd94c53264",
    "evidence_ids": [
      "EVID-FW-MATCH-ENSEMBLE-1036-9132"
    ],
    "source": "bindiff-inspired-ensemble-v2 source=xiaomi-band-10-pro-3.101.036 report=targets/xiaomi-band-9-3.1.32/evidence/fw-match/ensemble-1036-to-9132-v2.json"
  },
  "approval_state": "PENDING",
  "notes": "Generated candidate only; requires independent ABI/callsite review before promotion. state=CANDIDATE confidence=0.4892 margin=0.0002"
}
