{
  "schema": 1,
  "symbol_id": "xiaomi-band-10-pro-3.101.043.probe.lvx_msgbox_set_content",
  "target_id": "xiaomi-band-10-pro-3.101.043",
  "name": "lvx_msgbox_set_content",
  "kind": "function",
  "instruction_set": "thumb",
  "entry_address": "0xc4ca130",
  "callable_address": "0xc4ca131",
  "prototype": "void(void *box, uint32_t mode, const char *title, const char *body, const char *aux, const void *buttons, uint32_t count)",
  "calling_convention": "arm-aapcs",
  "contexts": {
    "allowed": [
      "native_manager_owner"
    ],
    "blocking": false
  },
  "proof": {
    "static": "candidate",
    "device": "not_probed",
    "evidence_ids": [
      "EVID-FW-MATCH-ENSEMBLE-1036-1043"
    ]
  },
  "policy": "restricted",
  "status": "CANDIDATE",
  "provenance": {
    "firmware_sha256": "519307675665e4866d722a8119a98589c397b614ac3294cb87bfc86de45756ec",
    "evidence_ids": [
      "EVID-FW-MATCH-ENSEMBLE-1036-1043"
    ],
    "source": "bindiff-inspired-ensemble-v2 source=xiaomi-band-10-pro-3.101.036 report=targets/xiaomi-band-10-pro-3.101.043/evidence/fw-match/ensemble-1036-to-1043-v2.json"
  },
  "approval_state": "PENDING",
  "notes": "Generated candidate only; requires independent ABI/callsite review before promotion. state=REVIEW_REQUIRED confidence=0.9911 margin=0.5538"
}
