{
  "schema": 1,
  "symbol_id": "xiaomi-band-9-3.1.32.modlib.insmod",
  "target_id": "xiaomi-band-9-3.1.32",
  "name": "insmod",
  "kind": "function",
  "instruction_set": "thumb",
  "prototype": "void *(const char *, const char *)",
  "proof": {
    "static": "candidate",
    "device": "not_probed",
    "evidence_ids": [
      "EVID-FW-MATCH-ENSEMBLE-1036-9132"
    ]
  },
  "policy": "restricted",
  "status": "CANDIDATE",
  "provenance": {
    "firmware_sha256": "9c02dab4020b2cc9666ee7d34cf27d311b76aadcec519a38361bbcbd94c53264",
    "evidence_ids": [
      "EVID-FW-MATCH-ENSEMBLE-1036-9132"
    ],
    "source": "bindiff-inspired-ensemble-v2 source=xiaomi-band-10-pro-3.101.036 report=targets/xiaomi-band-9-3.1.32/evidence/fw-match/ensemble-1036-to-9132-v2.json"
  },
  "entry_address": "0xc148a40",
  "callable_address": "0xc148a41",
  "notes": "Generated candidate only; requires independent ABI/callsite review before promotion. state=CANDIDATE confidence=0.6288 margin=0.0000",
  "approval_state": "PENDING"
}
