{
  "schema": 1,
  "symbol_id": "xiaomi-band-11-4.100.139.system_router_get_pages_wrapper",
  "target_id": "xiaomi-band-11-4.100.139",
  "name": "system_router_get_pages_wrapper",
  "kind": "function",
  "entry_address": "0xc8e21bc",
  "instruction_set": "thumb",
  "calling_convention": "arm-aapcs",
  "proof": {
    "static": "candidate",
    "device": "not_probed",
    "evidence_ids": [
      "EVID-FW-MATCH-ENSEMBLE-1043-4139"
    ]
  },
  "policy": "restricted",
  "status": "CANDIDATE",
  "approval_state": "PENDING",
  "provenance": {
    "firmware_sha256": "31ce82257f7c127950dc5070b86316730cf468a41f0d004559e41e7d923b2c74",
    "evidence_ids": [
      "EVID-FW-MATCH-ENSEMBLE-1043-4139"
    ],
    "source": "bindiff-inspired-ensemble-v2 source=xiaomi-band-10-pro-3.101.043 report=targets/xiaomi-band-11-4.100.139/evidence/fw-match/ensemble-1043-to-4139-v2.json"
  },
  "notes": "Generated candidate only; requires independent ABI/callsite review before promotion. state=CANDIDATE confidence=0.5638 margin=0.0756",
  "callable_address": "0xc8e21bd"
}
