{
  "schema": 1,
  "symbol_id": "xiaomi-band-10-3.1.28.private_abi.l2cap_local_flow_event",
  "target_id": "xiaomi-band-10-3.1.28",
  "name": "l2cap_local_flow_event",
  "kind": "function",
  "instruction_set": "thumb",
  "entry_address": "0xc3c09c4",
  "prototype": "int(void *,uint32_t,void *)",
  "calling_convention": "arm-aapcs",
  "contexts": {
    "allowed": [
      "target-private"
    ],
    "blocking": false
  },
  "ownership": {
    "argument": "Callback event allocation is borrowed synchronously and released by stock owner after return. Do not free in module.",
    "return_value": "stock buffer ownership retained/released by owner"
  },
  "proof": {
    "static": "recovered",
    "device": "not_probed",
    "evidence_ids": [
      "EVID-O66-ASTROLINK-ABI-002"
    ]
  },
  "policy": "restricted",
  "status": "STATIC_RECOVERED",
  "approval_state": "PENDING",
  "provenance": {
    "firmware_sha256": "fb726472416e99ba11d1c20ce8f0d4f0831a6e9a673d63bb5918e2c3921d8845",
    "evidence_ids": [
      "EVID-O66-ASTROLINK-ABI-002"
    ],
    "source": "Allocates6 bytes: CID+0,reason+2,localflow+4; emits8 and frees after callback"
  },
  "notes": "Evidence for ownership, not a proposal to call low-level RX from module."
}
