{
  "schema": 1,
  "symbol_id": "xiaomi-band-10-pro-3.101.043.private_abi.p67_battery_child_get",
  "target_id": "xiaomi-band-10-pro-3.101.043",
  "name": "p67_battery_child_get",
  "kind": "function",
  "instruction_set": "thumb",
  "entry_address": "0x0c5886e0",
  "callable_address": "0x0c5886e1",
  "calling_convention": "arm-aapcs",
  "prototype": "void * (void *object, int32_t index)",
  "contexts": {
    "allowed": ["ui-owner-thread"],
    "blocking": false
  },
  "ownership": {
    "argument": "Borrowed live status-bar object; use only nonnegative index below validated child_count<=16 on serialized UI owner.",
    "return_value": "Borrowed native child pointer. Validate exact native/derived battery class and parent; require one unambiguous matching battery. No ownership transfer."
  },
  "proof": {
    "static": "recovered",
    "device": "not_probed",
    "evidence_ids": ["EVID-P67-BATTERY-TRANSPARENCY-001"]
  },
  "policy": "restricted",
  "status": "STATIC_RECOVERED",
  "approval_state": "PENDING",
  "provenance": {
    "firmware_sha256": "519307675665e4866d722a8119a98589c397b614ac3294cb87bfc86de45756ec",
    "evidence_ids": ["EVID-P67-BATTERY-TRANSPARENCY-001"],
    "source": "Exact .043 read-only native ABI audit of child-get AP thunk and battery creation at 0x0c504d28."
  },
  "notes": "Read-only discovery; do not assume a fixed child index or retain an unchecked child across mutation-capable native calls. Hardware NOT_PROBED."
}
