{
  "schema": 1,
  "symbol_id": "redmi-watch-6-3.100.043.private_abi.bt_timer_cancel",
  "target_id": "redmi-watch-6-3.100.043",
  "name": "bt_timer_cancel",
  "kind": "function",
  "instruction_set": "thumb",
  "entry_address": "0xc98f788",
  "prototype": "int(uint32_t *)",
  "calling_convention": "arm-aapcs",
  "contexts": {
    "allowed": [
      "target-private"
    ],
    "blocking": false
  },
  "proof": {
    "static": "recovered",
    "device": "not_probed",
    "evidence_ids": [
      "EVID-PORT-P65-001"
    ]
  },
  "policy": "restricted",
  "status": "STATIC_RECOVERED",
  "provenance": {
    "firmware_sha256": "a19b601477569765103eaf468b937bd8026b4d68ffa5c896bde222a79e475858",
    "evidence_ids": [
      "EVID-PORT-P65-001"
    ],
    "source": "Exact redmi-watch-6-3.100.043 image/IDB compared with xiaomi-band-10-pro-3.101.043: mutually unique full-body anchor; known callees consistent."
  },
  "approval_state": "PENDING",
  "notes": "mutually unique full-body anchor; known callees consistent. Source semantic status was STATIC_RECOVERED; matching does not upgrade an uncertain source name/prototype. ABI and ownership follow the source record only within the audited port scope. Physical device validation pending; no approval carries over from the source target. exact 3.101.043 recovery; mapped from 3.101.036 by dual-source fw-match and IDA shape review (bt_timer_cancel) Address refreshed by trusted-036 caller-neighborhood ensemble v2; semantic policy retained from the curated 043 record. Address refreshed by trusted-036 caller-neighborhood ensemble v2; semantic policy retained from the curated 043 record.",
  "callable_address": "0xc98f789"
}
